{
  "action": "local_implementation",
  "authority_constraints": [],
  "change_hash": "bef51b8878459af23fcc52067c038db447cf611afaa41797c6291d87cfee8fb5",
  "change_id": "v0.9.0-pypi-distribution",
  "clarifications": [],
  "current_state": "CLARIFIED",
  "evidence": {
    "evaluation_passed": {
      "hashes": {
        "change_hash": "bef51b8878459af23fcc52067c038db447cf611afaa41797c6291d87cfee8fb5",
        "context_hash": "b6e01268c9e83f1a41593b1c0b5faeac925a0bc0350d1d972911461a06cfeb00",
        "policy_hash": "5d83cd5cc6626114dc06371750edc25b926cd278e19c45e2f3fdb6018c245f68"
      },
      "satisfied": true,
      "source_ref": "docs/spec-driven-dev/changes/v0.9.0-pypi-distribution/evaluation.json"
    },
    "material_clarifications_resolved": {
      "hashes": {
        "change_hash": "bef51b8878459af23fcc52067c038db447cf611afaa41797c6291d87cfee8fb5",
        "context_hash": "7b90cd54c516147d2e54ff9fc29a513df1c3d0aa1fdb8fd3f991cbaa945810da",
        "policy_hash": "5d83cd5cc6626114dc06371750edc25b926cd278e19c45e2f3fdb6018c245f68"
      },
      "satisfied": true,
      "source_ref": "docs/spec-driven-dev/changes/v0.9.0-pypi-distribution/spec.md"
    },
    "spec_complete": {
      "hashes": {
        "change_hash": "bef51b8878459af23fcc52067c038db447cf611afaa41797c6291d87cfee8fb5",
        "context_hash": "65c729168a9e1ddabc0b68b1fa385e50ca2c24be95e6f82ffddca280960d6a1a",
        "policy_hash": "5d83cd5cc6626114dc06371750edc25b926cd278e19c45e2f3fdb6018c245f68"
      },
      "satisfied": true,
      "source_ref": "docs/spec-driven-dev/changes/v0.9.0-pypi-distribution/spec.md"
    },
    "plan_complete": {
      "satisfied": true,
      "source_ref": "docs/spec-driven-dev/changes/v0.9.0-pypi-distribution/plan.md",
      "hashes": {
        "change_hash": "bef51b8878459af23fcc52067c038db447cf611afaa41797c6291d87cfee8fb5",
        "context_hash": "dc43e91a87f29f73009302051ea80bb12b0cb872e16d165b0ee6b36849e7e7c4",
        "policy_hash": "5d83cd5cc6626114dc06371750edc25b926cd278e19c45e2f3fdb6018c245f68"
      }
    },
    "instruction_context_valid": {
      "satisfied": true,
      "source_ref": "docs/spec-driven-dev/changes/v0.9.0-pypi-distribution/evaluation.json",
      "hashes": {
        "change_hash": "bef51b8878459af23fcc52067c038db447cf611afaa41797c6291d87cfee8fb5",
        "context_hash": "dc43e91a87f29f73009302051ea80bb12b0cb872e16d165b0ee6b36849e7e7c4",
        "policy_hash": "5d83cd5cc6626114dc06371750edc25b926cd278e19c45e2f3fdb6018c245f68"
      }
    }
  },
  "exceptions": [],
  "facts": {
    "adds_external_dependency": {
      "confidence": 1.0,
      "corroboration": [],
      "extractor": "codex-repository-fact-extractor-v1",
      "observed_at_change": "bef51b8878459af23fcc52067c038db447cf611afaa41797c6291d87cfee8fb5",
      "source_ref": "docs/spec-driven-dev/changes/v0.9.0-pypi-distribution/plan.md",
      "source_type": "approved_plan",
      "value": true
    },
    "changes_infrastructure": {
      "confidence": 1.0,
      "corroboration": [],
      "extractor": "codex-repository-fact-extractor-v1",
      "observed_at_change": "bef51b8878459af23fcc52067c038db447cf611afaa41797c6291d87cfee8fb5",
      "source_ref": "docs/spec-driven-dev/changes/v0.9.0-pypi-distribution/plan.md",
      "source_type": "approved_plan",
      "value": true
    },
    "changes_public_contract": {
      "confidence": 1.0,
      "corroboration": [],
      "extractor": "codex-repository-fact-extractor-v1",
      "observed_at_change": "bef51b8878459af23fcc52067c038db447cf611afaa41797c6291d87cfee8fb5",
      "source_ref": "docs/spec-driven-dev/changes/v0.9.0-pypi-distribution/spec.md",
      "source_type": "approved_specification",
      "value": true
    },
    "deploys_to_production": {
      "confidence": 1.0,
      "corroboration": [],
      "extractor": "codex-repository-fact-extractor-v1",
      "observed_at_change": "bef51b8878459af23fcc52067c038db447cf611afaa41797c6291d87cfee8fb5",
      "source_ref": "docs/spec-driven-dev/changes/v0.9.0-pypi-distribution/spec.md",
      "source_type": "approved_scope_analysis",
      "value": false
    },
    "documentation_only": {
      "confidence": 1.0,
      "corroboration": [],
      "extractor": "codex-repository-fact-extractor-v1",
      "observed_at_change": "bef51b8878459af23fcc52067c038db447cf611afaa41797c6291d87cfee8fb5",
      "source_ref": "docs/spec-driven-dev/changes/v0.9.0-pypi-distribution/evidence.md",
      "source_type": "brownfield_inventory",
      "value": false
    },
    "instruction_system_change": {
      "confidence": 1.0,
      "corroboration": [],
      "extractor": "codex-repository-fact-extractor-v1",
      "observed_at_change": "bef51b8878459af23fcc52067c038db447cf611afaa41797c6291d87cfee8fb5",
      "source_ref": "docs/spec-driven-dev/changes/v0.9.0-pypi-distribution/spec.md",
      "source_type": "approved_scope_analysis",
      "value": false
    },
    "modifies_runtime_code": {
      "confidence": 0.98,
      "corroboration": [],
      "extractor": "codex-repository-fact-extractor-v1",
      "observed_at_change": "bef51b8878459af23fcc52067c038db447cf611afaa41797c6291d87cfee8fb5",
      "source_ref": "docs/spec-driven-dev/changes/v0.9.0-pypi-distribution/spec.md",
      "source_type": "approved_scope_analysis",
      "value": false
    }
  },
  "open_escalation": null,
  "resources": {
    "ci_reruns": 0,
    "elapsed_minutes": 0,
    "repair_attempts": 0
  },
  "responses": [],
  "schema_version": 1,
  "workflow_family": "release"
}
