{
  "schema_version": 1,
  "change_id": "v0.9.0-truth-audit-demo",
  "workflow_family": "brownfield",
  "action": "local_implementation",
  "current_state": "IMPLEMENTING",
  "change_hash": "d0910644f1ff7fe41441fc4055cb1f1c1bb9349120ba70f19b3d6666caf2301e",
  "facts": {
    "documentation_only": {
      "value": false,
      "source_type": "approved_scope_analysis",
      "source_ref": "docs/superpowers/specs/2026-07-25-v090-truth-audit-demo-design.md",
      "extractor": "codex-repository-fact-extractor-v1",
      "confidence": 1.0,
      "observed_at_change": "d0910644f1ff7fe41441fc4055cb1f1c1bb9349120ba70f19b3d6666caf2301e",
      "corroboration": []
    },
    "modifies_runtime_code": {
      "value": true,
      "source_type": "approved_plan",
      "source_ref": "docs/superpowers/plans/2026-07-25-v090-truth-audit-demo.md",
      "extractor": "codex-repository-fact-extractor-v1",
      "confidence": 1.0,
      "observed_at_change": "d0910644f1ff7fe41441fc4055cb1f1c1bb9349120ba70f19b3d6666caf2301e",
      "corroboration": []
    },
    "changes_public_contract": {
      "value": false,
      "source_type": "approved_scope_analysis",
      "source_ref": "docs/superpowers/specs/2026-07-25-v090-truth-audit-demo-design.md",
      "extractor": "codex-repository-fact-extractor-v1",
      "confidence": 1.0,
      "observed_at_change": "d0910644f1ff7fe41441fc4055cb1f1c1bb9349120ba70f19b3d6666caf2301e",
      "corroboration": []
    },
    "adds_external_dependency": {
      "value": false,
      "source_type": "dependency_manifest_analysis",
      "source_ref": "pyproject.toml",
      "extractor": "codex-repository-fact-extractor-v1",
      "confidence": 1.0,
      "observed_at_change": "d0910644f1ff7fe41441fc4055cb1f1c1bb9349120ba70f19b3d6666caf2301e",
      "corroboration": []
    },
    "deploys_to_production": {
      "value": false,
      "source_type": "approved_scope_analysis",
      "source_ref": "docs/superpowers/specs/2026-07-25-v090-truth-audit-demo-design.md",
      "extractor": "codex-repository-fact-extractor-v1",
      "confidence": 1.0,
      "observed_at_change": "d0910644f1ff7fe41441fc4055cb1f1c1bb9349120ba70f19b3d6666caf2301e",
      "corroboration": []
    },
    "instruction_system_change": {
      "value": false,
      "source_type": "split_scope_analysis",
      "source_ref": "docs/superpowers/specs/2026-07-25-v090-truth-audit-demo-design.md",
      "extractor": "codex-repository-fact-extractor-v1",
      "confidence": 1.0,
      "observed_at_change": "d0910644f1ff7fe41441fc4055cb1f1c1bb9349120ba70f19b3d6666caf2301e",
      "corroboration": []
    }
  },
  "clarifications": [],
  "exceptions": [],
  "authority_constraints": [],
  "evidence": {
    "evaluation_passed": {
      "satisfied": true,
      "source_ref": "docs/spec-driven-dev/changes/v0.9.0-truth-audit-demo/evaluation.json",
      "hashes": {
        "change_hash": "d0910644f1ff7fe41441fc4055cb1f1c1bb9349120ba70f19b3d6666caf2301e",
        "context_hash": "768d4c1492bb0439cd9958d2f0d8c24b97e09fca5ca5210f2d78aabf633ffb95",
        "policy_hash": "d0416dab300bbcfbf7fba95bb51b1d1aeda7725d945560d0fbb0ce4f3dc6a3fa"
      }
    },
    "spec_complete": {
      "satisfied": true,
      "source_ref": "docs/spec-driven-dev/changes/v0.9.0-truth-audit-demo/spec.md",
      "hashes": {
        "change_hash": "d0910644f1ff7fe41441fc4055cb1f1c1bb9349120ba70f19b3d6666caf2301e",
        "context_hash": "1035e34c6e0ece3e9427fcb1a49f93d9ec00b8e0f3db32c92960c31aa3fad7fb",
        "policy_hash": "d0416dab300bbcfbf7fba95bb51b1d1aeda7725d945560d0fbb0ce4f3dc6a3fa"
      }
    },
    "material_clarifications_resolved": {
      "satisfied": true,
      "source_ref": "docs/superpowers/specs/2026-07-25-v090-truth-audit-demo-design.md",
      "hashes": {
        "change_hash": "d0910644f1ff7fe41441fc4055cb1f1c1bb9349120ba70f19b3d6666caf2301e",
        "context_hash": "0636db0b7fd0ab543cc15cd7b6b518c293860ee5bcff7bafd9c1cd0d52edbcec",
        "policy_hash": "d0416dab300bbcfbf7fba95bb51b1d1aeda7725d945560d0fbb0ce4f3dc6a3fa"
      }
    },
    "plan_complete": {
      "satisfied": true,
      "source_ref": "docs/superpowers/plans/2026-07-25-v090-truth-audit-demo.md",
      "hashes": {
        "change_hash": "d0910644f1ff7fe41441fc4055cb1f1c1bb9349120ba70f19b3d6666caf2301e",
        "context_hash": "fa202a30db286c17285f2c3a4ce401609dcaa1fa284ffb986f5509670b2acc4b",
        "policy_hash": "d0416dab300bbcfbf7fba95bb51b1d1aeda7725d945560d0fbb0ce4f3dc6a3fa"
      }
    },
    "instruction_context_valid": {
      "satisfied": true,
      "source_ref": "docs/spec-driven-dev/changes/v0.9.0-truth-audit-demo/evaluation.json",
      "hashes": {
        "change_hash": "d0910644f1ff7fe41441fc4055cb1f1c1bb9349120ba70f19b3d6666caf2301e",
        "context_hash": "fa202a30db286c17285f2c3a4ce401609dcaa1fa284ffb986f5509670b2acc4b",
        "policy_hash": "d0416dab300bbcfbf7fba95bb51b1d1aeda7725d945560d0fbb0ce4f3dc6a3fa"
      }
    },
    "tasks_trace_to_acceptance": {
      "satisfied": true,
      "source_ref": "docs/spec-driven-dev/changes/v0.9.0-truth-audit-demo/tasks.md",
      "hashes": {
        "change_hash": "d0910644f1ff7fe41441fc4055cb1f1c1bb9349120ba70f19b3d6666caf2301e",
        "context_hash": "68f641bc4f1d3bb24822f6b63a4b2d8b582c6055e449594e752815358dc4b835",
        "policy_hash": "d0416dab300bbcfbf7fba95bb51b1d1aeda7725d945560d0fbb0ce4f3dc6a3fa"
      }
    },
    "artifact_analysis_clean": {
      "satisfied": true,
      "source_ref": "docs/spec-driven-dev/changes/v0.9.0-truth-audit-demo/evidence.md",
      "hashes": {
        "change_hash": "d0910644f1ff7fe41441fc4055cb1f1c1bb9349120ba70f19b3d6666caf2301e",
        "context_hash": "f3b61f9ac24a441ec74f34f478a2586b91a0d24fdba9648f7556da9d539b83e4",
        "policy_hash": "d0416dab300bbcfbf7fba95bb51b1d1aeda7725d945560d0fbb0ce4f3dc6a3fa"
      }
    },
    "implementation_authorized": {
      "satisfied": true,
      "source_ref": "docs/spec-driven-dev/changes/v0.9.0-truth-audit-demo/evaluation.json",
      "hashes": {
        "change_hash": "d0910644f1ff7fe41441fc4055cb1f1c1bb9349120ba70f19b3d6666caf2301e",
        "context_hash": "364f501ce3fe126284c991f498fdb0776ec8aef7907961c45ce9e437d8d199b4",
        "policy_hash": "d0416dab300bbcfbf7fba95bb51b1d1aeda7725d945560d0fbb0ce4f3dc6a3fa"
      }
    }
  },
  "resources": {
    "repair_attempts": 0,
    "ci_reruns": 0,
    "elapsed_minutes": 0
  },
  "open_escalation": null,
  "responses": []
}
