{
  "schema_version": 1,
  "change_id": "b3-chain-before-sign-linker",
  "workflow_family": "feature",
  "action": "local_implementation",
  "current_state": "COMPLETE",
  "change_hash": "079edadcd568eabc391132c587f9e547a0d7f7cf7a8a8d43a739d6c9fc63fb35",
  "facts": {
    "documentation_only": {
      "value": false,
      "source_type": "approved_implementation_plan",
      "source_ref": "docs/superpowers/plans/2026-07-30-b3-chain-before-sign-linker.md",
      "extractor": "codex-repository-fact-extractor-v1",
      "confidence": 1.0,
      "observed_at_change": "079edadcd568eabc391132c587f9e547a0d7f7cf7a8a8d43a739d6c9fc63fb35",
      "corroboration": []
    },
    "modifies_runtime_code": {
      "value": true,
      "source_type": "approved_implementation_plan",
      "source_ref": "docs/superpowers/plans/2026-07-30-b3-chain-before-sign-linker.md",
      "extractor": "codex-repository-fact-extractor-v1",
      "confidence": 1.0,
      "observed_at_change": "079edadcd568eabc391132c587f9e547a0d7f7cf7a8a8d43a739d6c9fc63fb35",
      "corroboration": []
    },
    "modifies_authorization": {
      "value": true,
      "source_type": "approved_security_design",
      "source_ref": "docs/superpowers/specs/2026-07-30-enforcement-core-security-remediation-design.md",
      "extractor": "codex-repository-fact-extractor-v1",
      "confidence": 1.0,
      "observed_at_change": "079edadcd568eabc391132c587f9e547a0d7f7cf7a8a8d43a739d6c9fc63fb35",
      "corroboration": []
    },
    "changes_public_contract": {
      "value": true,
      "source_type": "approved_implementation_plan",
      "source_ref": "docs/superpowers/plans/2026-07-30-b3-chain-before-sign-linker.md",
      "extractor": "codex-repository-fact-extractor-v1",
      "confidence": 1.0,
      "observed_at_change": "079edadcd568eabc391132c587f9e547a0d7f7cf7a8a8d43a739d6c9fc63fb35",
      "corroboration": []
    },
    "adds_external_dependency": {
      "value": false,
      "source_type": "approved_implementation_plan",
      "source_ref": "docs/superpowers/plans/2026-07-30-b3-chain-before-sign-linker.md",
      "extractor": "codex-repository-fact-extractor-v1",
      "confidence": 1.0,
      "observed_at_change": "079edadcd568eabc391132c587f9e547a0d7f7cf7a8a8d43a739d6c9fc63fb35",
      "corroboration": []
    },
    "deploys_to_production": {
      "value": false,
      "source_type": "approved_scope_analysis",
      "source_ref": "docs/superpowers/plans/2026-07-30-enforcement-core-plan-index.md",
      "extractor": "codex-repository-fact-extractor-v1",
      "confidence": 1.0,
      "observed_at_change": "079edadcd568eabc391132c587f9e547a0d7f7cf7a8a8d43a739d6c9fc63fb35",
      "corroboration": []
    },
    "instruction_system_change": {
      "value": false,
      "source_type": "approved_scope_analysis",
      "source_ref": "docs/superpowers/plans/2026-07-30-b3-chain-before-sign-linker.md",
      "extractor": "codex-repository-fact-extractor-v1",
      "confidence": 1.0,
      "observed_at_change": "079edadcd568eabc391132c587f9e547a0d7f7cf7a8a8d43a739d6c9fc63fb35",
      "corroboration": []
    }
  },
  "clarifications": [],
  "exceptions": [],
  "authority_constraints": [],
  "evidence": {
    "evaluation_passed": {
      "satisfied": true,
      "source_ref": "docs/spec-driven-dev/changes/b3-chain-before-sign-linker/evidence.md",
      "hashes": {
        "policy_hash": "d0416dab300bbcfbf7fba95bb51b1d1aeda7725d945560d0fbb0ce4f3dc6a3fa",
        "context_hash": "3dcdb3845193f2765c3f705c690fc6684303b22e15ce3506fcb34eddbaaeb331",
        "change_hash": "079edadcd568eabc391132c587f9e547a0d7f7cf7a8a8d43a739d6c9fc63fb35"
      }
    },
    "spec_complete": {
      "satisfied": true,
      "source_ref": "docs/superpowers/specs/2026-07-30-enforcement-core-security-remediation-design.md",
      "hashes": {
        "policy_hash": "d0416dab300bbcfbf7fba95bb51b1d1aeda7725d945560d0fbb0ce4f3dc6a3fa",
        "context_hash": "3dcdb3845193f2765c3f705c690fc6684303b22e15ce3506fcb34eddbaaeb331",
        "change_hash": "079edadcd568eabc391132c587f9e547a0d7f7cf7a8a8d43a739d6c9fc63fb35"
      }
    },
    "material_clarifications_resolved": {
      "satisfied": true,
      "source_ref": "docs/spec-driven-dev/changes/b3-chain-before-sign-linker/evidence.md",
      "hashes": {
        "policy_hash": "d0416dab300bbcfbf7fba95bb51b1d1aeda7725d945560d0fbb0ce4f3dc6a3fa",
        "context_hash": "3dcdb3845193f2765c3f705c690fc6684303b22e15ce3506fcb34eddbaaeb331",
        "change_hash": "079edadcd568eabc391132c587f9e547a0d7f7cf7a8a8d43a739d6c9fc63fb35"
      }
    },
    "plan_complete": {
      "satisfied": true,
      "source_ref": "docs/superpowers/plans/2026-07-30-b3-chain-before-sign-linker.md",
      "hashes": {
        "policy_hash": "d0416dab300bbcfbf7fba95bb51b1d1aeda7725d945560d0fbb0ce4f3dc6a3fa",
        "context_hash": "3dcdb3845193f2765c3f705c690fc6684303b22e15ce3506fcb34eddbaaeb331",
        "change_hash": "079edadcd568eabc391132c587f9e547a0d7f7cf7a8a8d43a739d6c9fc63fb35"
      }
    },
    "instruction_context_valid": {
      "satisfied": true,
      "source_ref": "docs/spec-driven-dev/changes/b3-chain-before-sign-linker/context.json",
      "hashes": {
        "policy_hash": "d0416dab300bbcfbf7fba95bb51b1d1aeda7725d945560d0fbb0ce4f3dc6a3fa",
        "context_hash": "3dcdb3845193f2765c3f705c690fc6684303b22e15ce3506fcb34eddbaaeb331",
        "change_hash": "079edadcd568eabc391132c587f9e547a0d7f7cf7a8a8d43a739d6c9fc63fb35"
      }
    },
    "tasks_trace_to_acceptance": {
      "satisfied": true,
      "source_ref": "docs/superpowers/plans/2026-07-30-b3-chain-before-sign-linker.md",
      "hashes": {
        "policy_hash": "d0416dab300bbcfbf7fba95bb51b1d1aeda7725d945560d0fbb0ce4f3dc6a3fa",
        "context_hash": "3dcdb3845193f2765c3f705c690fc6684303b22e15ce3506fcb34eddbaaeb331",
        "change_hash": "079edadcd568eabc391132c587f9e547a0d7f7cf7a8a8d43a739d6c9fc63fb35"
      }
    },
    "artifact_analysis_clean": {
      "satisfied": true,
      "source_ref": "docs/superpowers/plans/2026-07-30-enforcement-core-plan-index.md",
      "hashes": {
        "policy_hash": "d0416dab300bbcfbf7fba95bb51b1d1aeda7725d945560d0fbb0ce4f3dc6a3fa",
        "context_hash": "3dcdb3845193f2765c3f705c690fc6684303b22e15ce3506fcb34eddbaaeb331",
        "change_hash": "079edadcd568eabc391132c587f9e547a0d7f7cf7a8a8d43a739d6c9fc63fb35"
      }
    },
    "implementation_authorized": {
      "satisfied": true,
      "source_ref": "docs/spec-driven-dev/changes/b3-chain-before-sign-linker/evidence.md",
      "hashes": {
        "policy_hash": "d0416dab300bbcfbf7fba95bb51b1d1aeda7725d945560d0fbb0ce4f3dc6a3fa",
        "context_hash": "996988c0edde1a44cdd937a8c0f957342b5f223839a6b2717e0abd72a2f72fc6",
        "change_hash": "079edadcd568eabc391132c587f9e547a0d7f7cf7a8a8d43a739d6c9fc63fb35"
      }
    },
    "implementation_tasks_complete": {
      "satisfied": true,
      "source_ref": "docs/spec-driven-dev/changes/b3-chain-before-sign-linker/evidence.md",
      "hashes": {
        "policy_hash": "d0416dab300bbcfbf7fba95bb51b1d1aeda7725d945560d0fbb0ce4f3dc6a3fa",
        "context_hash": "c0634bacd7a595430ee729cc38160e0299dceacd3a0c2b0078982fd3d18061c5",
        "change_hash": "079edadcd568eabc391132c587f9e547a0d7f7cf7a8a8d43a739d6c9fc63fb35"
      }
    },
    "local_validation_passed": {
      "satisfied": true,
      "source_ref": "docs/spec-driven-dev/changes/b3-chain-before-sign-linker/evidence.md",
      "hashes": {
        "policy_hash": "d0416dab300bbcfbf7fba95bb51b1d1aeda7725d945560d0fbb0ce4f3dc6a3fa",
        "context_hash": "89b0339f11b4baf947e46bf9734a6e3f332803875050ae2e0c37528e0b52af60",
        "change_hash": "079edadcd568eabc391132c587f9e547a0d7f7cf7a8a8d43a739d6c9fc63fb35"
      }
    },
    "required_reviews_passed": {
      "satisfied": true,
      "source_ref": "docs/spec-driven-dev/changes/b3-chain-before-sign-linker/evidence.md",
      "hashes": {
        "policy_hash": "d0416dab300bbcfbf7fba95bb51b1d1aeda7725d945560d0fbb0ce4f3dc6a3fa",
        "context_hash": "790c69d7869a3aa7cb9298d252da4f92e1a0019d3f6229905e7a326738a5f1b6",
        "change_hash": "079edadcd568eabc391132c587f9e547a0d7f7cf7a8a8d43a739d6c9fc63fb35"
      }
    },
    "required_ci_passed": {
      "satisfied": true,
      "source_ref": "docs/spec-driven-dev/changes/b3-chain-before-sign-linker/evidence.md",
      "hashes": {
        "policy_hash": "d0416dab300bbcfbf7fba95bb51b1d1aeda7725d945560d0fbb0ce4f3dc6a3fa",
        "context_hash": "790c69d7869a3aa7cb9298d252da4f92e1a0019d3f6229905e7a326738a5f1b6",
        "change_hash": "079edadcd568eabc391132c587f9e547a0d7f7cf7a8a8d43a739d6c9fc63fb35"
      }
    },
    "convergence_passed": {
      "satisfied": true,
      "source_ref": "docs/spec-driven-dev/changes/b3-chain-before-sign-linker/evidence.md",
      "hashes": {
        "policy_hash": "d0416dab300bbcfbf7fba95bb51b1d1aeda7725d945560d0fbb0ce4f3dc6a3fa",
        "context_hash": "18ab53cf206ba6e2bbb26415c16d9b14c00f50ae49f5378144cd8bd34f95df7d",
        "change_hash": "079edadcd568eabc391132c587f9e547a0d7f7cf7a8a8d43a739d6c9fc63fb35"
      }
    }
  },
  "resources": {
    "repair_attempts": 2,
    "ci_reruns": 0,
    "elapsed_minutes": 0
  },
  "open_escalation": null,
  "responses": []
}
